{"$schema":"https://json-schema.org/draft/2020-12/schema","additionalProperties":false,"description":"Closed synthetic structured patch input; semantic and hash validation is enforced by dpslab.patch_format_adapter.","properties":{"changes":{"items":{"type":"object"},"type":"array"},"identity":{"type":"object"},"integrity":{"type":"object"},"schema_version":{"const":"0.1"},"source":{"type":"object"}},"required":["schema_version","identity","source","changes","integrity"],"title":"DpsLab structured patch input 0.1","type":"object"}
