{"changes":[{"certainty":"exact","change_id":"synthetic-change-1","citation_token":"section.synthetic.1","invalidation_kinds":[],"new_token":"synthetic-coefficient-b","old_token":"synthetic-coefficient-a","operation":"change","semantic_kind":"synthetic.damage.coefficient","subject_tokens":["spec.synthetic","class.synthetic"]}],"identity":{"created_at":"2026-07-31T15:02:00Z","input_id":"synthetic.structured.patch.1","lifecycle":"current"},"integrity":{"hash_algorithm":"sha256","input_sha256":"acafc9faadafc7444b2d2de6bb546ce0caa8dedb19565cb75bce106b088be33d"},"schema_version":"0.1","source":{"acquisition_class":"manual","authenticity_class":"human_attested","build_max":120500,"build_min":120500,"captured_at":"2026-07-31T15:01:00Z","content_sha256":"bbbbbbbbbbbbbbbbbbbbbbbbbbbbbbbbbbbbbbbbbbbbbbbbbbbbbbbbbbbbbbbb","interface_max":120500,"interface_min":120500,"license_class":"first_party_reference","media_type":"structured_patch_note","published_at":"2026-07-31T15:00:00Z","source_family":"synthetic.patch.notes","source_owner":"synthetic.publisher","source_revision":"synthetic-r2","supersedes_evidence_id":null,"wow_product":"retail"}}
